Попробуйте вот этот: https://tmall.aliexpress.com/item/Sweaters-MODIS-M182W00110-jumper-sweater-clothes-apparel-pullover-for-female-for-woman-TmallFS/32926522667.html	Вот этот вроде ничего: https://tmall.aliexpress.com/item/Sweaters-MODIS-M181W00562-women-jumper-sweater-clothes-apparel-pullover-for-female-TmallFS/32910119775.html	А вот это вам как? https://tmall.aliexpress.com/item/Sweaters-MODIS-M182W00352-jumper-sweater-clothes-apparel-pullover-for-female-for-woman-TmallFS/32926542460.html	
Как вам такая модель? https://tmall.aliexpress.com/item/Pants-Capris-MODIS-M181S00023-pants-woman-trousers-for-female-TmallFS/32876609712.html	Возможно, вот это вам подойдёт: https://tmall.aliexpress.com/item/Women-s-leather-pants-tom-farr-T-W1527/1000006911531.html	Сегодня популярна вот эта модель: https://tmall.aliexpress.com/item/Pants-C-H-I-C/1000006843233.html	
Например, вот: https://tmall.aliexpress.com/item/Dresses-MODIS-M182D00043-dress-cotton-clothes-apparel-casual-for-female-for-woman-TmallFS/32926883966.html	Есть вот такая модель: https://tmall.aliexpress.com/item/Dress-Bezko-BE2080-Women-s-clothes-women/1000007229076.html	Вот это платье, возможно, вам подойдёт: https://tmall.aliexpress.com/item/Dress-Color-Black/1000006750616.html	
Айфончики есть у нас, настоящие: https://tmall.aliexpress.com/item/Smartphone-Apple-iPhone-SE-32GB/1000004436065.html	Huawei неплохой выбор: https://tmall.aliexpress.com/item/Smartphone-Honor-7c-Pro-mobile-phone/32882460371.html	Вот эта модель сейчас в тренде: https://tmall.aliexpress.com/item/Smartphone-HUAWEI-Nova-3i-huawei-nova3i-Mobile-phone/1000007065066.html	
Отличный выбор для бабушки: https://ru.aliexpress.com/item/Uniwa-V708-Old-Man-Mobile-Phone-Charging-Cradle-Senior-Kids-Feature-Phone-GSM-FM-Radio-Big/32897244486.html	Просто и кнопки большие: https://ru.aliexpress.com/item/Uniwa-V708-Feature-Mobile-Phone-Charging-Cradle-Senior-Old-Man-Phone-Kids-GSM-FM-Radio-Big/32899501063.html	Простая и надёжная звонилка: https://ru.aliexpress.com/item/Uniwa-V708-Feature-Mobile-Phone-Charging-Cradle-Senior-Kids-Mini-Phone-Russian-Keypad-2G-GSM-Push/32885952197.html	
Вот он, самый популярный фитнес-трекер: https://tmall.aliexpress.com/item/Smart-watch-Mi-Band-3/1000006690374.html	Настоящий фитнес-браслет: https://ru.aliexpress.com/item/Global-Version-Xiaomi-Mi-Band-3-Miband-3-Smart-Tracker-Band-Instant-Message-5ATM-Waterproof-OLED/32881422628.html	Вот, например: https://ru.aliexpress.com/item/Promotion-Original-Xiaomi-Mi-Band-2-Miband-Band2-Wristband-Bracelet-with-Smart-Heart-Rate-Fitness-Tracker/32784377513.html	
Xiaomi (Сяоми) всегда в ходу: https://tmall.aliexpress.com/item/Smartphone-Xiaomi-Redmi-5-telephone-2GB-16GB-phone/32865023815.html	Вот Redmi 6a, например: https://tmall.aliexpress.com/item/Smartphone-Xiaomi-Redmi-6A-16gb-xiaomi-mi/32904618453.html	Лопата, но людям нравится: https://tmall.aliexpress.com/item/Xiaomi-Redmi-Note-5-64-1/32887162294.html	
Вот наша подборка на сегодня: ХХХ, ННН, ЗЗЗ			
Купоны от AliExpress (Спецкупоны, например) действуют на любой заказ. А купоны от продавцов – только в конкретном магазине. Ищите купоны в магазинах и в разных акциях.			
Монеты можно зарабатывать в играх, и обменивать на купоны. Игры есть в приложении AliExpress – рекомендую установить!			
Посмотрите в разделе “Мои заказы” на сайте или в приложении	Можете найти в разделе “Мои заказы” в приложении	Смотрели в разделе “Мои заказы”?	
Всё о доставке с Tmall вот здесь: https://tmall.aliexpress.com/ru/__pc/pages/delivery.htm			
Гарантия есть на все товары, почитайте подробнее тут: https://sale.aliexpress.com/ru/__pc/ru/guarantee_service.htm			
Рекомендую раздел “Горящие товары”, там новые скидки каждый день: https://group.aliexpress.com/ru.htm	Посмотрите “Горящие товары”: https://group.aliexpress.com/ru.htm		
Есть раздел “Всё до $5”, вот тут: https://sale.aliexpress.com/ru/__pc/ru_lowcoster2_pc.htm	Посмотрите страницу “Всё до $5”: https://sale.aliexpress.com/ru/__pc/ru_lowcoster2_pc.htm		
Клип про Тимати? Вот же он: https://www.youtube.com/watch?v=XwtMGUFjTmo	Вы наверное вот это искали: https://www.youtube.com/watch?v=XwtMGUFjTmo	Хороший клип, мне нравится: https://www.youtube.com/watch?v=XwtMGUFjTmo	
Tmall для России вот здесь: https://tmall.aliexpress.com/	Tmall (читается “Ти-мол”) у нас вот тут: https://tmall.aliexpress.com/		
Фейками не торгуем. И зачем? У нас и настоящие бренды не дорогие.	Фейков не держим.	Фейки не пройдут!	За фейками – к цыганам. У нас всё настоящее.
Джек Ма (по-китайски 马云 – Ма Юнь) – основатель Aibaba Group, в которую входит AliExpress. Крутой дядька, хоть и лицо квадратное.	Джек Ма (по-китайски 马云 – Ма Юнь) – основатель Aibaba Group, в которую входит AliExpress. Это один из самых богатых людей в Китае.	Джек Ма (по-китайски 马云 – Ма Юнь) – основатель Aibaba Group, в которую входит AliExpress.	
Alibaba Group – это огромная китайская компания, в которую входит и AliExpress. А ещё Taobao, Alipay, Tmall и Cainiao.	Alibaba Group – это огромная китайская компания, в которую входит и AliExpress. И даже Alibaba.com, где закупаются оптом.		
Я не Siri и шуток не знаю.	Почитайте описание любого товара на AliExpress!	У меня с чувством юмора плохо.	
Хозяева рассказывают мне о лучших предложениях, а я рассказываю о них вам. Попробуйте спросить про “лучший смартфон” или “красивое платье”. О скидках и купонах тоже могу рассказать.	Пока я не очень умный. Но могу рассказать где взять скидки, купоны, и подсказать что-нибудь интересное. Просто спросите!	У меня каждый день есть свежие подборки интересных товаров. Просто скажите, что вам интересно.	
Ну зачем так грубо. Лучше скажите, чем вам помочь.	Я ещё только учусь. Попробуйте спросить меня про скидки, купоны или о про какие-то товары.	Как грубо :-(	
